{
  "schema_version": "1.0.0",
  "content_version": "1ec94e9c6dac515c5d172117d7f4e1c108870984517bd308d24dc7c220581806",
  "locale": "es",
  "records": [
    {
      "id": "lucas-figueroa",
      "kind": "profile",
      "title": "Lucas Figueroa",
      "claims": [
        {
          "claim_id": "profile-role",
          "text": "Conversational AI Engineer y Backend Developer.",
          "provenance_id": "cv-page-1"
        },
        {
          "claim_id": "profile-contact",
          "text": "Contacto: (+54) 11 6542-7871 y lucas.200061@gmail.com.",
          "provenance_id": "cv-page-1"
        },
        {
          "claim_id": "profile-links",
          "text": "LinkedIn: linkedin.com/in/lucasfigueroa-dev. GitHub: github.com/lucas22-f.",
          "provenance_id": "cv-page-1"
        },
        {
          "claim_id": "profile-summary",
          "text": "Especializado en agentes inteligentes, sistemas RAG, servidores MCP y automatización empresarial con Python; integra modelos de lenguaje, APIs corporativas y plataformas cloud.",
          "provenance_id": "cv-page-1"
        },
        {
          "claim_id": "profile-scale",
          "text": "Experiencia freelance diseñando e implementando soluciones de IA conversacional para plataformas corporativas de gran escala.",
          "provenance_id": "cv-page-1"
        }
      ],
      "tags": [
        "conversational-ai",
        "backend",
        "python"
      ],
      "aliases": [
        "Lucas",
        "Lucas Figueroa",
        "perfil"
      ],
      "provenance": [
        "cv-page-1"
      ]
    },
    {
      "id": "conversational-ai-freelance",
      "kind": "experience",
      "title": "Conversational AI Engineer — Freelance",
      "claims": [
        {
          "claim_id": "experience-role",
          "text": "Conversational AI Engineer freelance en proyectos para una plataforma de e-commerce líder en Latinoamérica (cliente bajo acuerdo de confidencialidad), desde junio de 2025 hasta la actualidad, en modalidad remota desde Buenos Aires, Argentina.",
          "provenance_id": "cv-page-1"
        },
        {
          "claim_id": "experience-botmaker",
          "text": "Diseño, desarrollo y mantenimiento de workflows de chatbots internos en Botmaker, para procesos utilizados por miles de usuarios corporativos en la región.",
          "provenance_id": "cv-page-1"
        },
        {
          "claim_id": "experience-code-actions",
          "text": "Implementación de Code Actions en Node.js con APIs corporativas de RRHH (SAP SuccessFactors) para automatizar vacaciones, liquidaciones y datos de empleados.",
          "provenance_id": "cv-page-1"
        },
        {
          "claim_id": "experience-dataflow",
          "text": "Pipelines de datos en Python y BigQuery (GCP) para procesamiento y notificación masiva a usuarios a gran escala.",
          "provenance_id": "cv-page-1"
        },
        {
          "claim_id": "experience-fury",
          "text": "Desarrollo e integración de aplicaciones sobre infraestructura cloud propietaria del cliente.",
          "provenance_id": "cv-page-1"
        },
        {
          "claim_id": "experience-verdi",
          "text": "Migración de flujos legacy hacia una plataforma interna de IA generativa, con procesos YAML asistidos por IA.",
          "provenance_id": "cv-page-1"
        },
        {
          "claim_id": "experience-mcp",
          "text": "Migración de flujos legacy hacia una arquitectura de servidores MCP en Python con FastMCP.",
          "provenance_id": "cv-page-1"
        },
        {
          "claim_id": "experience-rag",
          "text": "Implementación de sistemas RAG para brindar a los bots fuentes de conocimiento dinámicas y actualizadas.",
          "provenance_id": "cv-page-1"
        },
        {
          "claim_id": "experience-production",
          "text": "Participación en múltiples proyectos simultáneos, entregando soluciones en producción utilizadas por usuarios corporativos en toda la región.",
          "provenance_id": "cv-page-1"
        }
      ],
      "tags": [
        "conversational-ai",
        "python",
        "nodejs"
      ],
      "aliases": [
        "freelance",
        "experiencia"
      ],
      "provenance": [
        "cv-page-1"
      ]
    },
    {
      "id": "utn-tecnico-programacion",
      "kind": "education",
      "title": "Técnico Universitario en Programación",
      "claims": [
        {
          "claim_id": "education-programming-status",
          "text": "Carrera cursada en UTN FRA entre 2023 y 2026, con materias finalizadas y título en trámite.",
          "provenance_id": "cv-page-1"
        },
        {
          "claim_id": "education-programming-subjects",
          "text": "Materias: SQL, Python, Java, MongoDB, Angular, NestJS, arquitectura y patrones de diseño.",
          "provenance_id": "cv-page-1"
        }
      ],
      "tags": [
        "utn",
        "programacion"
      ],
      "aliases": [
        "UTN FRA",
        "Técnico en Programación"
      ],
      "provenance": [
        "cv-page-1"
      ]
    },
    {
      "id": "utn-full-stack-mern",
      "kind": "education",
      "title": "Desarrollo Web Full Stack (MERN)",
      "claims": [
        {
          "claim_id": "education-mern",
          "text": "Formación en UTN BA entre 2020 y 2021 sobre MongoDB, Express, React y Node.js.",
          "provenance_id": "cv-page-1"
        }
      ],
      "tags": [
        "utn",
        "mern"
      ],
      "aliases": [
        "UTN BA",
        "MERN"
      ],
      "provenance": [
        "cv-page-1"
      ]
    },
    {
      "id": "skills-bots",
      "kind": "skill",
      "title": "Bots y automatización",
      "claims": [
        {
          "claim_id": "skills-bots-claim",
          "text": "Botmaker, agentes conversacionales y workflows multicanal.",
          "provenance_id": "cv-page-1"
        }
      ],
      "tags": [
        "botmaker",
        "automation"
      ],
      "aliases": [
        "Bots y automatización"
      ],
      "provenance": [
        "cv-page-1"
      ]
    },
    {
      "id": "skills-ai",
      "kind": "skill",
      "title": "IA y LLMs",
      "claims": [
        {
          "claim_id": "skills-ai-claim",
          "text": "IA generativa, MCP, RAG, embeddings y sistemas de conocimiento.",
          "provenance_id": "cv-page-1"
        }
      ],
      "tags": [
        "ai",
        "mcp",
        "rag"
      ],
      "aliases": [
        "IA y LLMs"
      ],
      "provenance": [
        "cv-page-1"
      ]
    },
    {
      "id": "skills-backend",
      "kind": "skill",
      "title": "Backend",
      "claims": [
        {
          "claim_id": "skills-backend-claim",
          "text": "Node.js, Python, APIs REST e integración con SAP SuccessFactors.",
          "provenance_id": "cv-page-1"
        }
      ],
      "tags": [
        "backend",
        "python",
        "nodejs"
      ],
      "aliases": [
        "Backend"
      ],
      "provenance": [
        "cv-page-1"
      ]
    },
    {
      "id": "skills-data-cloud",
      "kind": "skill",
      "title": "Datos y cloud",
      "claims": [
        {
          "claim_id": "skills-data-cloud-claim",
          "text": "BigQuery, GCP y pipelines de datos.",
          "provenance_id": "cv-page-1"
        }
      ],
      "tags": [
        "data",
        "cloud",
        "gcp"
      ],
      "aliases": [
        "Datos y cloud"
      ],
      "provenance": [
        "cv-page-1"
      ]
    },
    {
      "id": "skills-frontend",
      "kind": "skill",
      "title": "Frontend",
      "claims": [
        {
          "claim_id": "skills-frontend-claim",
          "text": "React, Angular y TypeScript.",
          "provenance_id": "cv-page-1"
        }
      ],
      "tags": [
        "frontend",
        "angular"
      ],
      "aliases": [
        "Frontend"
      ],
      "provenance": [
        "cv-page-1"
      ]
    },
    {
      "id": "skills-databases",
      "kind": "skill",
      "title": "Bases de datos",
      "claims": [
        {
          "claim_id": "skills-databases-claim",
          "text": "MongoDB, SQL y MySQL.",
          "provenance_id": "cv-page-1"
        }
      ],
      "tags": [
        "database",
        "sql"
      ],
      "aliases": [
        "Bases de datos"
      ],
      "provenance": [
        "cv-page-1"
      ]
    },
    {
      "id": "skills-languages",
      "kind": "skill",
      "title": "Idiomas",
      "claims": [
        {
          "claim_id": "skills-languages-claim",
          "text": "Español nativo e inglés B1.",
          "provenance_id": "cv-page-1"
        }
      ],
      "tags": [
        "languages"
      ],
      "aliases": [
        "Idiomas"
      ],
      "provenance": [
        "cv-page-1"
      ]
    },
    {
      "id": "cert-full-stack",
      "kind": "education",
      "title": "Diplomatura en Programación Web Full Stack",
      "claims": [
        {
          "claim_id": "cert-full-stack-claim",
          "text": "Certificación de UTN, ID CER-NO9H77PR-69154.",
          "provenance_id": "cv-page-1"
        }
      ],
      "tags": [
        "certification"
      ],
      "aliases": [
        "Diplomatura en Programación Web Full Stack"
      ],
      "provenance": [
        "cv-page-1"
      ]
    },
    {
      "id": "cert-web-inicial",
      "kind": "education",
      "title": "Programador Web Inicial",
      "claims": [
        {
          "claim_id": "cert-web-inicial-claim",
          "text": "Certificación de UTN, ID CER-SOI8CTEK74019.",
          "provenance_id": "cv-page-1"
        }
      ],
      "tags": [
        "certification"
      ],
      "aliases": [
        "Programador Web Inicial"
      ],
      "provenance": [
        "cv-page-1"
      ]
    },
    {
      "id": "cert-prompting",
      "kind": "education",
      "title": "Prompting inicial",
      "claims": [
        {
          "claim_id": "cert-prompting-claim",